标题,日期,内容简介,链接,图片链接,新闻详情内容,详情页图片链接,供稿
学校召开首期“与理工共成长――书记有约”学生座谈会,2024.12.13,"12月12日下午，首期“与理工共成长――书记有约”学生座谈会在勤业楼207会议室举行。校党委书记王凌宇，党委副书记、副校长刘德强，副校长张众，相关职能部门负责人和各学院毕业生代表面对面交流。座谈会由学生处处长何炉进主持。

前期学校通过WeLink面向本研毕业生发布问卷征集学生提案，共收集247份问卷，汇总整理提案80余份，本次座谈会邀请到其中16位本研毕业生代表出席,其他提案学校将反馈相关部门进行答复。",/2024/1213/c921a61003/page.htm,/_upload/article/images/1d/65/54fd8b4048dca592b2d5761326ba/3cb689d2-d908-4779-8e8e-af5a5f343a24.jpg,"[""12月12日下午，首期“与理工共成长――书记有约”学生座谈会在勤业楼207会议室举行。校党委书记王凌宇，党委副书记、副校长刘德强，副校长张众，相关职能部门负责人和各学院毕业生代表面对面交流。座谈会由学生处处长何炉进主持。"", ""前期学校通过WeLink面向本研毕业生发布问卷征集学生提案，共收集247份问卷，汇总整理提案80余份，本次座谈会邀请到其中16位本研毕业生代表出席,其他提案学校将反馈相关部门进行答复。"", ""各位学生代表畅谈自己在校这几年学校日新月异的变化和个人在各方面的成长。围绕人才培养，提出希望进一步建设好实习实践基地，为学生提供更多实习机会，加强实践能力的培养，课程更好对接产业前沿，引进更多企业专家进校授课和讲座，进一步优化毕业设计与求职考研时间，教材与时俱进等。在就业方面，希望在求职相关法律知识普及、求职简历指导、求职能力提升、行业招聘会，更多送学生进企业等方面进一步加强。在校园管理服务方面，围绕食堂饭菜质量提升，打印服务优化，防诈骗宣传教育实效，电动充电桩分布，车辆行驶安全，宿舍设施完善，公共场所抽烟管理等方面，结合自身的经历和调研情况，提出了很多合理化建议。相关职能部门老师与同学们进行了交流，表示会汲取大家好的意见建议，把各项工作做的更好。"", ""张众结合自己的成长和学习经历与同学们进行交流，他指出，同学们不同阶段有着不同的需求，在大学期间，不仅是学习知识，更重要的是提高自我学习的能力、自我发展的意识、自我培养的主动性。学校也将持续推动教育教学改革，建设好产教融合、科教融汇实践平台，也希望同学们能勇于面对挑战，更好发挥自身主观能动性，在奋斗和磨砺中成长为更好的自己。"", ""王凌宇在讲话中，对毕业班同学们对母校提出的中肯意见建议表示感谢，要求各部门对大家的合理化建议要尽快研究，推动落实。他指出，近年来，在全校师生的共同奋斗下，学校人才培养水平、社会声望等各方面不断提升，环境和条件持续优化改善。学校高度重视学生培养工作，希望每一位同学通过在校学习夯实基础知识、提升实践能力，能够自信的面对未来，更好为国家做贡献。同学们在学校学习，不仅要关心眼前和身边事，更要关心世界和国家事，通过学习、实习实践、志愿服务等培养扎实的学识和能力，提升自己的格局和视野，形成相对稳定的社会认知观念和健全的人格"", ""王凌宇指出，学校也将结合同学们的意见建议，进一步在三个方面持续深化人才培养工作：一是提高人才培养实战性。学校将持续推进培养模式改革，深化产教融合，加大力度与重点行业企业进行深度协同，提升学生的实操能力，让学生在进入社会时能够实现无缝衔接。二是提升学生自我成才的主动性。学校将搭建更多校内外实践平台，激发学生自我成才的主动性积极性，加强学生自主自立能力培养，让更多学生在学校得到自主锻炼，提升各方面能力，促进社会化进程。三是提高学生成才适配性。学校将在日常教育教学、创新创业教育和第二课堂活动中，加强逻辑思维与表达能力训练。通过思政教育，培养学生形成正确的世界观、人生观、价值观，学会辩证理性地认识和分析问题的立场，减少盲动和迷茫，提高与企业和社会的适配性。"", ""最后，王凌宇代表学校祝愿各位毕业生拥有美好的前程，未来成为校友后继续积极关注和参与母校的建设和发展，为建设更加美好的上理贡献自己的力量，母校永远是大家温暖的家和坚强后盾。"", ""“与理工共成长―书记有约”是学校为更好凝聚全体上理人的力量，汲取全体上理人的智慧，更好推动学校高质量发展搭建的校领导与师生校友交流平台，未来学校将进一步持续深化，推动高质量意见建议落实落地，为学校改革发展做出更大贡献。""]","[""https://www.usst.edu.cn/_upload/article/images/1d/65/54fd8b4048dca592b2d5761326ba/de46df8f-32f8-496b-929b-990823a533b4.jpg"", ""https://www.usst.edu.cn/_upload/article/images/1d/65/54fd8b4048dca592b2d5761326ba/3cb689d2-d908-4779-8e8e-af5a5f343a24.jpg""]",["供稿：学生工作部（处）、党委（校长）办公室"]
中德国际学院联合管理委员会召开第十一次会议,2024.12.12,12月10日下午，中德国际学院联合管理委员会召开第十一次会议。上海理工大学校长、中德国际学院新任联合管理委员会主席朱新远，副校长兼中德国际学院院长蔡永莲，副校长张华，教务处、国际交流处、财务处、中德国际学院、光电学院及机械学院负责人和项目负责人参加会议。德国汉堡应用技术大学德方项目负责人胡特教授（Michael R?ther）、富特旺根应用技术大学德方项目负责人郝赫教授（Markus Hoch）、科堡应用技术与艺术大学德方项目负责人瓦克教授（Jasmin Walk）、东巴伐利亚雷根斯堡应用科技大学德方项目负责人席莱内尔（Rupert Schreiner）教授以及上海理工大学中德国际学院特聘德语语言文化教授Marcus Hernig视频参会。会议由朱新远主持。,/2024/1211/c921a60968/page.htm,/_upload/article/images/22/9f/7d6d593b4d0cb15e64017947af87/ad054199-6f9c-4d8d-b50d-f289c7a28f2c.jpg,"[""12月10日下午，中德国际学院联合管理委员会召开第十一次会议。上海理工大学校长、中德国际学院新任联合管理委员会主席朱新远，副校长兼中德国际学院院长蔡永莲，副校长张华，教务处、国际交流处、财务处、中德国际学院、光电学院及机械学院负责人和项目负责人参加会议。德国汉堡应用技术大学德方项目负责人胡特教授（Michael R?ther）、富特旺根应用技术大学德方项目负责人郝赫教授（Markus Hoch）、科堡应用技术与艺术大学德方项目负责人瓦克教授（Jasmin Walk）、东巴伐利亚雷根斯堡应用科技大学德方项目负责人席莱内尔（Rupert Schreiner）教授以及上海理工大学中德国际学院特聘德语语言文化教授Marcus Hernig视频参会。会议由朱新远主持。"", ""蔡永莲通报中德国际学院联合管委会人事变动。根据《上海理工大学中德国际学院章程》规定，校长朱新远接任中德国际学院联合管委会主席，教务处处长单彦广接任中德国际学院联合管理委员会委员。"", ""朱新远在欢迎辞中表示，非常荣幸作为新任主席参加中德国际学院联合管理委员会会议并与德方各合作高校的德方项目负责人共同商讨中德国际学院的未来发展。他指出，上海理工大学的办学文脉之一是1907年创办的德文医工学堂，学校自建校之初就与德国有着非常紧密的联系。中德国际学院是我校对德合作办学的示范窗口，学院上下同心同德，齐心协力，始终保持与德方合作高校的良好且有效的沟通，保障了教学工作的有序开展和学生的高质量培养。期待与德方一起共同推动中德国际学院以及上海理工大学对德合作项目的高质量发展。"", ""随后，中德国际学院常务副院长陈琦从2024年度招生及就业、学院年度重要工作、德语教学、海外交流、实验室建设、挑战与应对等方面作学院年度工作汇报，中德国际学院所含汉堡、富特旺根、科堡及雷根斯堡合作项目的中德双方项目负责人汇报一年来的项目运行及进展情况，Marcus Hernig教授汇报德语语言教学与发展规划情况。双方与会代表就德语教学、学生互访交流以及学生国际化培养等问题开展了热烈且极具建设性的交流探讨。"", ""朱新远在总结讲话中指出，2024年中德国际学院推进了多项重大工作，如学院作为中外合作办学机构正在进行中国教育部的延期审核；上海理工大学与汉堡应用技术大学签署了新一轮合作办学协议；汉堡项目的电气、机械和国贸三个专业完成ASIIN认证复评估的进校考察，且取得了专家积极的反馈意见。他表示，感谢中德双方同事为上述工作的顺利开展付出的辛勤劳动，未来面对新的合作阶段以及新的国际高等教育形势，学校将进一步坚定全球化的发展战略，继续以开放的姿态为中德双方学生提供更优质的资源，不断培养学生的国际化视野和跨文化交流能力，让更多的学生从中德合作办学项目中受益，也期待在中德双方各合作高校的共同努力下，中德教育合作更加深入。""]","[""https://www.usst.edu.cn/_upload/article/images/22/9f/7d6d593b4d0cb15e64017947af87/783fc967-6e35-4f51-bf16-48e5cd102afd.jpg"", ""https://www.usst.edu.cn/_upload/article/images/22/9f/7d6d593b4d0cb15e64017947af87/ad054199-6f9c-4d8d-b50d-f289c7a28f2c.jpg""]",["供稿：中德国际学院"]
学校体育健身中心正式启用,2024.12.09,12月6日上海理工大学体育健身中心启用仪式在体育健身中心二楼举行。上海市大学生体育协会会长薛明扬，市教委体卫艺科处处长陈华，市教委体卫艺科处副处长时多，上海市大学生体育协会副秘书长任科来，杨浦区体育局局长汤佳云，世界水球冠军、国家体育一级奖章获得者张|，上海理工大学党委书记王凌宇，上海市各高校体育部主任以及学校相关职能部处负责人、体育运动委员会委员、师生代表等齐聚一堂。启动仪式由副校长张华主持。全新的北区操场及体育健身中心启动仪式现场王凌宇致开幕辞王凌宇致开幕辞，他指出上海理工大学在推进高水平大学建设过程中，坚持以服务学生全面发展为目标，不断深化体育教育教学改革，推进“五育并举”与“三全育人”有机融合，引导学生在体育锻炼中享受乐趣、增强体质、健全人格、锤炼意志。近年来，学校持续加大体育基础设施建设力度，在市教委的大力支持下，经过四年多的共同努力，学校体育健身中心终于在全校师生的期盼下，从蓝图顺利落地并投入启用。体育健身中心正式投入使用，不仅为师生日常体育锻炼提供了重要场所，更提供了一个展示自我、超越自我的舞台，同时还承载着高校对社会的责任与担当，学校将积极响应国家全民健身的号召，加强与,/2024/1209/c921a60907/page.htm,/_upload/article/images/f3/aa/875e5c3e4e9ab4b311847c1b9d6e/9ca89902-1c4c-44a3-8111-5a0a398b9a36.jpg,"[""12月6日上海理工大学体育健身中心启用仪式在体育健身中心二楼举行。上海市大学生体育协会会长薛明扬，市教委体卫艺科处处长陈华，市教委体卫艺科处副处长时多，上海市大学生体育协会副秘书长任科来，杨浦区体育局局长汤佳云，世界水球冠军、国家体育一级奖章获得者张|，上海理工大学党委书记王凌宇，上海市各高校体育部主任以及学校相关职能部处负责人、体育运动委员会委员、师生代表等齐聚一堂。启动仪式由副校长张华主持。"", ""王凌宇致开幕辞，他指出上海理工大学在推进高水平大学建设过程中，坚持以服务学生全面发展为目标，不断深化体育教育教学改革，推进“五育并举”与“三全育人”有机融合，引导学生在体育锻炼中享受乐趣、增强体质、健全人格、锤炼意志。近年来，学校持续加大体育基础设施建设力度，在市教委的大力支持下，经过四年多的共同努力，学校体育健身中心终于在全校师生的期盼下，从蓝图顺利落地并投入启用。体育健身中心正式投入使用，不仅为师生日常体育锻炼提供了重要场所，更提供了一个展示自我、超越自我的舞台，同时还承载着高校对社会的责任与担当，学校将积极响应国家全民健身的号召，加强与周边社区及社会各界开展更广泛合作，为推进体育强国、健康中国贡献力量。他希望全校师生在健身中心落成之际，以更饱满的热情、更昂扬的斗志、更强健的体魄、更优的精神面貌迎接未来的挑战与机遇，不断开创新时代学校事业蓬勃发展的新局面。"", ""汤佳云在致辞中指出杨浦区深入贯彻落实党中央、市委关于体育工作的决策部署，持续加大对体育设施、体育活动、体育服务的供给，体育事业取得长足发展。并感谢上海理工大学在三区融合中“以体育人”工作的生动实践，希望今后区校进一步加强合作，协同推进杨浦社区体育事业发展的新篇章。"", ""陈华在致辞中对上海理工大学体育工作给予了高度评价，高度赞扬了学校积极向上的校园氛围。她强调了学校立德树人的核心使命，并指出体育教育是其中不可或缺的一环，要充分发挥体育教育作用，培养出更多德智体美劳全面发展的优秀人才，为国家的繁荣与发展贡献力量。"", ""上理工老领导薛明扬在致辞中表达了对学校体育事业发展，健身中心落成的自豪，并强调在立德树人过程中体育处于重要的“C位”，育人的责任更重大、使命更光荣，他希望通过学校体育不懈努力，把广大青年学生培养成“德、智、体、美、劳”全面发展的社会主义建设者和可靠的接班人。"", ""原体育教学部主任倪伟教授作为这一工程全过程的见证者，代表学校体育工作者感谢各级领导、各部门对学校体育工作的支持。学生代表韩诗悦代表广大上理学子表达了对学校基础设施条件改善后，上理学子收获满满幸福感和喜悦感。"", ""学校体育健身中心的顺利启用，离不开市教委的重视与支持，也离不开学校老领导、师生校友的关心和推动。随后，与会领导嘉宾与学生代表共同按下体育健身中心启用按钮，上海理工大学体育健身中心正式启用。"", ""启动仪式后学校2024年冬季长跑顺利开跑。在体育健身中心启用的喜悦中，在美丽的沪江园，上理师生在世界水球冠军、国家体育一级奖章获得者张|带领下从毛主席像顺利出发。"", ""经过激烈角逐，陈建乐（学号23*****310），职欣然（学号23*****104），钱Z（工号***21）分获得男子、女子、教工组冠军。基础学院、管理学院、光电信息与计算机工程学院获得男子组团体前三名，管理学院、基础学院、材料与化学学院获得女子组团体前三名。"", ""同期，2024年上海市高校体育教学部（系）主任第二期培训班在我校举行，培训班围绕高校高水平运动竞赛组织与管理，共同探讨高校体育面临的新形势、新任务和新挑战，并为上海市高校体育教育事业的发展提供新思路和新方案。""]","[""https://www.usst.edu.cn/_upload/article/images/f3/aa/875e5c3e4e9ab4b311847c1b9d6e/9ca89902-1c4c-44a3-8111-5a0a398b9a36.jpg"", ""https://www.usst.edu.cn/_upload/article/images/f3/aa/875e5c3e4e9ab4b311847c1b9d6e/fa09baf1-e0b5-4a39-bb47-a71d3ef74df6.jpg"", ""https://www.usst.edu.cn/_upload/article/images/f3/aa/875e5c3e4e9ab4b311847c1b9d6e/cd01415a-deb2-4608-9fb1-ecd5cd2e1d12.jpg"", ""https://www.usst.edu.cn/_upload/article/images/f3/aa/875e5c3e4e9ab4b311847c1b9d6e/b013d1df-e68b-45a4-a619-89e0673b0b63.jpg"", ""https://www.usst.edu.cn/_upload/article/images/f3/aa/875e5c3e4e9ab4b311847c1b9d6e/92aeff44-46f5-4baa-b7f7-48321deb4c18.jpg"", ""https://www.usst.edu.cn/_upload/article/images/f3/aa/875e5c3e4e9ab4b311847c1b9d6e/95076d1d-0b55-4771-bb09-5a670fc97928.jpg"", ""https://www.usst.edu.cn/_upload/article/images/f3/aa/875e5c3e4e9ab4b311847c1b9d6e/2c467eab-2cb3-4e79-a478-1dea7d53b372.jpg"", ""https://www.usst.edu.cn/_upload/article/images/f3/aa/875e5c3e4e9ab4b311847c1b9d6e/aa822a06-f6aa-4add-a98c-664beef1e05e.jpg"", ""https://www.usst.edu.cn/_upload/article/images/f3/aa/875e5c3e4e9ab4b311847c1b9d6e/5dd6ee55-13a4-46e8-b3a9-658f79410f5e.jpg"", ""https://www.usst.edu.cn/_upload/article/images/f3/aa/875e5c3e4e9ab4b311847c1b9d6e/2bb6fc73-43bf-4571-aea1-119061470053.jpg"", ""https://www.usst.edu.cn/_upload/article/images/f3/aa/875e5c3e4e9ab4b311847c1b9d6e/0c65655f-4e80-48c2-be77-5fa40fb8cc96.jpg"", ""https://www.usst.edu.cn/_upload/article/images/f3/aa/875e5c3e4e9ab4b311847c1b9d6e/a9f05eb0-0c75-4d9a-8aa6-a749bf7997ae.jpg"", ""https://www.usst.edu.cn/_upload/article/images/f3/aa/875e5c3e4e9ab4b311847c1b9d6e/a0915094-c4e6-4228-ac55-267287d342cf.jpg""]",["供稿：体育部"]
中英国际学院召开2024年联合管理委员会第二次会议,2024.12.09,12月6日下午，中英国际学院2024年联合管理委员会第二次会议在复兴路校区举行。校长、中英国际学院联合管理委员会主任朱新远，副校长、中英国际学院院长蔡永莲等中方管委会成员，哈德斯菲尔德大学校长兼首席执行官罗伯特・安东尼・克莱恩（Robert Anthony Cryan），斯图尔特・史密斯（Stuart Smith）等英方管委会成员出席会议。中英国际学院执行院长鲁伯特・沃德（Rupert Ward）、学院班子成员列席会议。会议由朱新远主持。会议现场朱新远对英国合作大学和英国北方大学联合会为关心和支持学校合作办学事业所作出的努力和贡献表示感谢。他指出，自今年7月26日召开联合管理委员会以来，中英国际学院各项工作稳步推进，取得了长足发展。今年学院改革了计划外自主招生政策，生源结构不断优化，生源质量持续提升。学校高度重视中英国际学院事业发展，大力推进学院基础设施建设，进一步改善学生学习生活环境，助力学生全面发展。学院积极“引进来”拓宽合作渠道，在合作办学、联合培养、质量保障、国际认证、教师互访、学生互换、双创教育、国际暑期夏校等方面与合作伙伴高校开展合作与交流，为进一步深化合作关系奠定了基础；,/2024/1208/c921a60894/page.htm,/_upload/article/images/7c/4f/6d9e57d24a3c89e39d60b9a77e30/a4d076e4-db31-4157-b826-a57331fbf5c8.jpg,"[""12月6日下午，中英国际学院2024年联合管理委员会第二次会议在复兴路校区举行。校长、中英国际学院联合管理委员会主任朱新远，副校长、中英国际学院院长蔡永莲等中方管委会成员，哈德斯菲尔德大学校长兼首席执行官罗伯特・安东尼・克莱恩（Robert Anthony Cryan），斯图尔特・史密斯（Stuart Smith）等英方管委会成员出席会议。中英国际学院执行院长鲁伯特・沃德（Rupert Ward）、学院班子成员列席会议。会议由朱新远主持。"", ""朱新远对英国合作大学和英国北方大学联合会为关心和支持学校合作办学事业所作出的努力和贡献表示感谢。他指出，自今年7月26日召开联合管理委员会以来，中英国际学院各项工作稳步推进，取得了长足发展。今年学院改革了计划外自主招生政策，生源结构不断优化，生源质量持续提升。学校高度重视中英国际学院事业发展，大力推进学院基础设施建设，进一步改善学生学习生活环境，助力学生全面发展。学院积极“引进来”拓宽合作渠道，在合作办学、联合培养、质量保障、国际认证、教师互访、学生互换、双创教育、国际暑期夏校等方面与合作伙伴高校开展合作与交流，为进一步深化合作关系奠定了基础；同时，学院主动“走出去”探索创新管理模式，搭建中外合作办学交流平台，为兄弟院校合作办学机构提供了有益经验，也为学院高质量发展提供新思路。在中外合作办学联席会成立十周年大会上，中英国际学院获颁中外合作办学联席会“突出贡献奖”，以表彰学院近年来在推动中外合作办学事业发展、提升教育质量、促进国际交流与合作等方面所做出的成就和贡献。朱新远表示，中英国际学院所有的进步和成绩离不开英国合作高校的关心和支持，希望双方进一步发挥各自优势，拓展合作领域，推动中英国际学院高质量发展再上新台阶。"", ""会上，联合管理委员会成员听取了Rupert Ward所作的工作报告，并就学院国际学生招生、自主招生项目、学生学业发展、教育教学质量、管理运行机制等方面进行深入探讨和交流。他代表学院向一直以来关心和支持学院各项事业发展的中英双方院校领导和同事们表示衷心感谢，表示将进一步加强与英方合作大学的合作与交流，促进国际协同创新，提升人才培养质量，奋力推动学院国际化事业再上新台阶。为表彰学院近年来高质量办学发展和取得的显著成就，中英国际学院荣获英方合作伙伴“杰出贡献奖”。"", ""联合管理委员会成员充分肯定了学院在2024年取得的新成果，高度评价了学院改革自主招生政策、优化生源结构、开展中外学生双向访学、持续推进国际认证、拓展国际交流与合作等方面的具体做法和显著成效，并对学院未来工作的开展提出希望和指导性意见。希望双方进一步发挥各自优势，深化合作，共同推动中英国际学院未来发展以及在各个层面上的深入合作，把中英两国高等教育合作推向新的高度。"", ""本次会议为中英国际学院下一步发展指明新目标、拓展新思路、探索新路径。学院将以本次会议为契机，进一步凝练办学特色，着力提升国际化人才培养质量、办学水平和办学层次。""]","[""https://www.usst.edu.cn/_upload/article/images/7c/4f/6d9e57d24a3c89e39d60b9a77e30/a4d076e4-db31-4157-b826-a57331fbf5c8.jpg"", ""https://www.usst.edu.cn/_upload/article/images/7c/4f/6d9e57d24a3c89e39d60b9a77e30/48a37b34-e34d-4581-b331-78c6b2863851.jpg""]",["供稿：中英国际学院"]
